id	url	source	notes
1	https://job-boards.greenhouse.io/anthropic/jobs/5134153008	Anthropic	AI Productivity Lead, Communications
2	https://job-boards.greenhouse.io/anthropic/jobs/4956672008	Anthropic	Analytics Data Engineer
3	https://job-boards.greenhouse.io/anthropic/jobs/5125387008	Anthropic	Analytics Data Engineering Manager, Product
4	https://job-boards.greenhouse.io/anthropic/jobs/5023394008	Anthropic	Anthropic AI Safety Fellow
5	https://job-boards.greenhouse.io/anthropic/jobs/5030244008	Anthropic	Anthropic AI Security Fellow
6	https://job-boards.greenhouse.io/anthropic/jobs/5014500008	Anthropic	Applied AI Engineer
7	https://job-boards.greenhouse.io/anthropic/jobs/5055488008	Anthropic	Applied AI Engineer
8	https://job-boards.greenhouse.io/anthropic/jobs/5116274008	Anthropic	Applied AI Engineer
9	https://job-boards.greenhouse.io/anthropic/jobs/5068226008	Anthropic	Applied AI Engineer, Beneficial Deployments
10	https://job-boards.greenhouse.io/anthropic/jobs/5057647008	Anthropic	Applied AI Engineer (Digital Natives Business)
11	https://job-boards.greenhouse.io/anthropic/jobs/5111942008	Anthropic	Applied AI Engineer, Life Sciences (Beneficial Deployments)
12	https://job-boards.greenhouse.io/anthropic/jobs/5073277008	Anthropic	Applied AI Engineer (Startups)
13	https://job-boards.greenhouse.io/anthropic/jobs/5066977008	Anthropic	Biological Safety Research Scientist
14	https://job-boards.greenhouse.io/anthropic/jobs/5116927008	Anthropic	Claude Evangelist, Applied AI (Startups)
15	https://job-boards.greenhouse.io/anthropic/jobs/5156057008	Anthropic	Data Engineer, Safeguards
16	https://job-boards.greenhouse.io/anthropic/jobs/5125881008	Anthropic	Data Science Engineer, Capacity & Efficiency
17	https://job-boards.greenhouse.io/anthropic/jobs/5161402008	Anthropic	Data Scientist, Marketing
18	https://job-boards.greenhouse.io/anthropic/jobs/5097186008	Anthropic	Design Engineer, AI Capability Development (Education Labs)
19	https://job-boards.greenhouse.io/anthropic/jobs/4741104008	Anthropic	Engineering Manager, GPU (ML Accelerator)
20	https://job-boards.greenhouse.io/anthropic/jobs/4532887008	Anthropic	[Expression of Interest] Research Scientist / Engineer, Honesty
21	https://job-boards.greenhouse.io/anthropic/jobs/5121561008	Anthropic	Forward Deployed Engineer, Applied AI
22	https://job-boards.greenhouse.io/anthropic/jobs/5121563008	Anthropic	Forward Deployed Engineer, Applied AI
23	https://job-boards.greenhouse.io/anthropic/jobs/4985877008	Anthropic	Forward Deployed Engineer, Applied AI
24	https://job-boards.greenhouse.io/anthropic/jobs/5012991008	Anthropic	Forward Deployed Engineer, Applied AI
25	https://job-boards.greenhouse.io/anthropic/jobs/5079562008	Anthropic	Forward Deployed Engineer, Applied AI (Federal Civilian)
26	https://job-boards.greenhouse.io/anthropic/jobs/5064817008	Anthropic	Head of Solutions Architects, Applied AI (Korea)
27	https://job-boards.greenhouse.io/anthropic/jobs/4952079008	Anthropic	Machine Learning Systems Engineer, Research Tools
28	https://job-boards.greenhouse.io/anthropic/jobs/4952051008	Anthropic	Machine Learning Systems Engineer, RL Engineering
29	https://job-boards.greenhouse.io/anthropic/jobs/5173031008	Anthropic	Manager, Applied AI Solutions Architecture - Partnerships
30	https://job-boards.greenhouse.io/anthropic/jobs/5142110008	Anthropic	Manager, Applied AI (Startups)
31	https://job-boards.greenhouse.io/anthropic/jobs/5149911008	Anthropic	Manager, Data Science, GTM
32	https://job-boards.greenhouse.io/anthropic/jobs/5117652008	Anthropic	Manager of Solutions Architecture, Applied AI (Industries)
33	https://job-boards.greenhouse.io/anthropic/jobs/4964610008	Anthropic	Manager of Solutions Architecture, Applied AI (Industries)
34	https://job-boards.greenhouse.io/anthropic/jobs/5115884008	Anthropic	Manager of Solutions Architecture, Applied AI (Industries)
35	https://job-boards.greenhouse.io/anthropic/jobs/5146999008	Anthropic	Manager of Solutions Architecture, Applied AI (Partnerships)
36	https://job-boards.greenhouse.io/anthropic/jobs/4778843008	Anthropic	ML Infrastructure Engineer, Safeguards
37	https://job-boards.greenhouse.io/anthropic/jobs/4949336008	Anthropic	ML/Research Engineer, Safeguards
38	https://job-boards.greenhouse.io/anthropic/jobs/5164616008	Anthropic	Partner Manager DACH/CEE (AI Boutiques)
39	https://job-boards.greenhouse.io/anthropic/jobs/5164620008	Anthropic	Partner Manager UK & North Europe, (AI Boutiques)
40	https://job-boards.greenhouse.io/anthropic/jobs/5112486008	Anthropic	Partner Solutions Architect, Applied AI
41	https://job-boards.greenhouse.io/anthropic/jobs/4950664008	Anthropic	Partner Solutions Architect, Applied AI
42	https://job-boards.greenhouse.io/anthropic/jobs/5112493008	Anthropic	Partner Solutions Architect, Applied AI
43	https://job-boards.greenhouse.io/anthropic/jobs/5125083008	Anthropic	Research Engineer, AI Observability
44	https://job-boards.greenhouse.io/anthropic/jobs/5115935008	Anthropic	Research Engineer, Machine Learning (Reinforcement Learning)
45	https://job-boards.greenhouse.io/anthropic/jobs/4613568008	Anthropic	Research Engineer, Machine Learning (Reinforcement Learning)
46	https://job-boards.greenhouse.io/anthropic/jobs/5074815008	Anthropic	Research Engineer/Research Scientist, Audio
47	https://job-boards.greenhouse.io/anthropic/jobs/5135168008	Anthropic	Research Engineer / Research Scientist, Pre-training
48	https://job-boards.greenhouse.io/anthropic/jobs/4951814008	Anthropic	Research Engineer / Research Scientist, Tokens
49	https://job-boards.greenhouse.io/anthropic/jobs/5074217008	Anthropic	Research Engineer / Research Scientist, Vision
50	https://job-boards.greenhouse.io/anthropic/jobs/5103788008	Anthropic	Research Scientist, Frontier Red Team (Emerging Risks)
51	https://job-boards.greenhouse.io/anthropic/jobs/4980427008	Anthropic	Research Scientist, Interpretability
52	https://job-boards.greenhouse.io/anthropic/jobs/5076616008	Anthropic	Research Scientist, Societal Impacts
53	https://job-boards.greenhouse.io/anthropic/jobs/5101433008	Anthropic	Security Architect, Applied AI
54	https://job-boards.greenhouse.io/anthropic/jobs/5024835008	Anthropic	Senior Research Scientist, Reward Models
55	https://job-boards.greenhouse.io/anthropic/jobs/4941996008	Anthropic	Software Engineer, Enterprise AI Products
56	https://job-boards.greenhouse.io/anthropic/jobs/4926242008	Anthropic	Software Engineer, ML Networking
57	https://job-boards.greenhouse.io/anthropic/jobs/5076109008	Anthropic	Solutions Architect, Applied AI
58	https://job-boards.greenhouse.io/anthropic/jobs/5117589008	Anthropic	Solutions Architect, Applied AI
59	https://job-boards.greenhouse.io/anthropic/jobs/5117581008	Anthropic	Solutions Architect, Applied AI
60	https://job-boards.greenhouse.io/anthropic/jobs/5146028008	Anthropic	Solutions Architect, Applied AI (Beneficial Deployments)
61	https://job-boards.greenhouse.io/anthropic/jobs/5062712008	Anthropic	Solutions Architect, Applied AI (Beneficial Deployments)
62	https://job-boards.greenhouse.io/anthropic/jobs/5124533008	Anthropic	Solutions Architect, Applied AI (Creatives)
63	https://job-boards.greenhouse.io/anthropic/jobs/5065835008	Anthropic	Solutions Architect, Applied AI (Digital Native Business)
64	https://job-boards.greenhouse.io/anthropic/jobs/5079540008	Anthropic	Solutions Architect, Applied AI (Federal Civilian)
65	https://job-boards.greenhouse.io/anthropic/jobs/5140405008	Anthropic	Solutions Architect, Applied AI (Government Technology)
66	https://job-boards.greenhouse.io/anthropic/jobs/4977626008	Anthropic	Solutions Architect, Applied AI (Industries)
67	https://job-boards.greenhouse.io/anthropic/jobs/4977624008	Anthropic	Solutions Architect, Applied AI (Industries)
68	https://job-boards.greenhouse.io/anthropic/jobs/4461444008	Anthropic	Solutions Architect, Applied AI (Industries)
69	https://job-boards.greenhouse.io/anthropic/jobs/5031670008	Anthropic	Solutions Architect, Applied AI (Industries)
70	https://job-boards.greenhouse.io/anthropic/jobs/5079511008	Anthropic	Solutions Architect, Applied AI (National Security)
71	https://job-boards.greenhouse.io/anthropic/jobs/4968059008	Anthropic	Solutions Architect, Applied AI (Startups)
72	https://job-boards.greenhouse.io/anthropic/jobs/5057258008	Anthropic	Solutions Architect, Applied AI (Startups)
73	https://job-boards.greenhouse.io/anthropic/jobs/5140403008	Anthropic	Solutions Architect, Applied AI (State and Local Government, West)
74	https://job-boards.greenhouse.io/anthropic/jobs/5113224008	Anthropic	Staff / Senior Software Engineer, AI Reliability
75	https://job-boards.greenhouse.io/anthropic/jobs/5101173008	Anthropic	Staff Software Engineer, AI Reliability Engineering
76	https://job-boards.greenhouse.io/anthropic/jobs/5101169008	Anthropic	Staff Software Engineer, AI Reliability Engineering
77	https://job-boards.greenhouse.io/anthropic/jobs/5122119008	Anthropic	Support Operations Specialist, AI Agent Management
78	https://job-boards.greenhouse.io/anthropic/jobs/5017903008	Anthropic	Technical Deployment, Applied AI
79	https://job-boards.greenhouse.io/anthropic/jobs/5153754008	Anthropic	Technical Deployment Lead, Applied AI
80	https://job-boards.greenhouse.io/anthropic/jobs/5153761008	Anthropic	Technical Deployment Lead, Applied AI
81	https://job-boards.greenhouse.io/anthropic/jobs/5149802008	Anthropic	Transformative AI Research Economist, Economic Research
82	https://job-boards.greenhouse.io/anthropic/jobs/5026097008	Anthropic	UI Software Engineer, Claude.ai Consumer Product
83	https://job-boards.eu.greenhouse.io/polyai/jobs/4710429101	PolyAI	AI Software Engineer (Must be based in Serbia)
84	https://job-boards.eu.greenhouse.io/polyai/jobs/4796935101	PolyAI	Forward Deployed AI Engineer (Must be PST timezone)
85	https://job-boards.eu.greenhouse.io/polyai/jobs/4822441101	PolyAI	Senior Partner Solutions Engineer
86	https://job-boards.eu.greenhouse.io/polyai/jobs/4594342101	PolyAI	Senior Research Scientist (Must be based in UK)
87	https://job-boards.eu.greenhouse.io/parloa/jobs/4784741101	Parloa	GSI Partnerships Manager -  (Conversational AI & Agentic AI)
88	https://job-boards.eu.greenhouse.io/parloa/jobs/4566280101	Parloa	Lead AI Agent Architect
89	https://job-boards.eu.greenhouse.io/parloa/jobs/4782800101	Parloa	Senior AI Agent Architect
90	https://job-boards.eu.greenhouse.io/parloa/jobs/4766701101	Parloa	Senior AI Agent Architect
91	https://job-boards.eu.greenhouse.io/parloa/jobs/4826898101	Parloa	Senior Data Analyst
92	https://job-boards.greenhouse.io/intercom/jobs/7609852	Intercom	Account Executive, Emerging AI Products
93	https://job-boards.greenhouse.io/intercom/jobs/7583124	Intercom	Account Executive, Emerging AI Products
94	https://job-boards.greenhouse.io/intercom/jobs/7603334	Intercom	Account Executive, Emerging AI Products
95	https://job-boards.greenhouse.io/intercom/jobs/7672152	Intercom	Growth Data Scientist
96	https://job-boards.greenhouse.io/intercom/jobs/7524848	Intercom	GTM Data Analyst - Integrated Campaigns
97	https://job-boards.greenhouse.io/intercom/jobs/7524826	Intercom	GTM Data Analyst - Scaled Digital Success
98	https://job-boards.greenhouse.io/intercom/jobs/7644940	Intercom	Manager, Solutions Engineering (Mid-Market & Enterprise)
99	https://job-boards.greenhouse.io/intercom/jobs/7644731	Intercom	Manager, Solutions Engineering (Mid-Market & Enterprise)
100	https://job-boards.greenhouse.io/intercom/jobs/7725837	Intercom	Principal Engineer, Fin AI Agent
101	https://job-boards.greenhouse.io/intercom/jobs/7681157	Intercom	Sales Operations Manager, Emerging AI Products
102	https://job-boards.greenhouse.io/intercom/jobs/7776018	Intercom	Senior AI Deployment Architect
103	https://job-boards.greenhouse.io/intercom/jobs/7774407	Intercom	Senior AI Deployment Architect
104	https://job-boards.greenhouse.io/intercom/jobs/7735288	Intercom	Senior AI Deployment Consultant
105	https://job-boards.greenhouse.io/intercom/jobs/7544457	Intercom	Senior AI Deployment Consultant
106	https://job-boards.greenhouse.io/intercom/jobs/7464294	Intercom	Senior AI Product Manager
107	https://job-boards.greenhouse.io/intercom/jobs/7377200	Intercom	Senior AI Product Manager
108	https://job-boards.greenhouse.io/intercom/jobs/7464291	Intercom	Senior AI Product Manager
109	https://job-boards.greenhouse.io/intercom/jobs/7574783	Intercom	Senior Data Engineering Manager
110	https://job-boards.greenhouse.io/intercom/jobs/7574762	Intercom	Senior Data Engineering Manager
111	https://job-boards.greenhouse.io/intercom/jobs/7749323	Intercom	Senior Data Scientist
112	https://job-boards.greenhouse.io/intercom/jobs/7314809	Intercom	Senior Data Scientist - AI Tooling
113	https://job-boards.greenhouse.io/intercom/jobs/7606649	Intercom	Senior Data Scientist AI Tooling
114	https://job-boards.greenhouse.io/intercom/jobs/7606638	Intercom	Senior Data Scientist AI Tooling
115	https://job-boards.greenhouse.io/intercom/jobs/6317929	Intercom	Senior Data Scientist - Product Analytics
116	https://job-boards.greenhouse.io/intercom/jobs/6949785	Intercom	Senior Engineer, AI Developer
117	https://job-boards.greenhouse.io/intercom/jobs/7436402	Intercom	Senior Growth Data Scientist
118	https://job-boards.greenhouse.io/intercom/jobs/7437796	Intercom	Senior Growth Data Scientist
119	https://job-boards.greenhouse.io/intercom/jobs/7652268	Intercom	Senior GTM Data Scientist
120	https://job-boards.greenhouse.io/intercom/jobs/7372016	Intercom	Senior Machine Learning Scientist
121	https://job-boards.greenhouse.io/intercom/jobs/7271603	Intercom	Senior Machine Learning Scientist
122	https://job-boards.greenhouse.io/intercom/jobs/6531495	Intercom	Senior Machine Learning Scientist
123	https://job-boards.greenhouse.io/intercom/jobs/7411373	Intercom	Senior ML Science Manager
124	https://job-boards.greenhouse.io/intercom/jobs/6276021	Intercom	Senior Product Engineer, AI
125	https://job-boards.greenhouse.io/intercom/jobs/7371924	Intercom	Senior Product Engineer, AI
126	https://job-boards.greenhouse.io/intercom/jobs/6466001	Intercom	Senior Product Engineer - AI Platform
127	https://job-boards.greenhouse.io/intercom/jobs/7382846	Intercom	Senior Product Engineer, AI Platform
128	https://job-boards.greenhouse.io/intercom/jobs/7594453	Intercom	Senior Solutions Engineer
129	https://job-boards.greenhouse.io/intercom/jobs/7573187	Intercom	Solutions Engineer
130	https://job-boards.greenhouse.io/intercom/jobs/6849119	Intercom	Solutions Engineer
131	https://job-boards.greenhouse.io/intercom/jobs/7593406	Intercom	Solutions Engineer - LATAM (Portuguese Speaking)
132	https://job-boards.greenhouse.io/intercom/jobs/7624926	Intercom	Solutions Engineer - LATAM (Portuguese Speaking)
133	https://job-boards.greenhouse.io/intercom/jobs/7560506	Intercom	Staff AI Analyst
134	https://job-boards.greenhouse.io/intercom/jobs/7271914	Intercom	Staff Machine Learning Scientist
135	https://job-boards.greenhouse.io/intercom/jobs/6654793	Intercom	Staff Machine Learning Scientist
136	https://job-boards.greenhouse.io/intercom/jobs/7383950	Intercom	Staff Product Engineer, AI
137	https://job-boards.greenhouse.io/intercom/jobs/7383963	Intercom	Staff Product Engineer, AI
138	https://job-boards.greenhouse.io/intercom/jobs/7393922	Intercom	Staff Product Engineer, AI
139	https://job-boards.greenhouse.io/intercom/jobs/7393955	Intercom	Staff Product Engineer, AI
140	https://job-boards.greenhouse.io/intercom/jobs/7393950	Intercom	Staff Product Engineer, AI
141	https://job-boards.greenhouse.io/humeai/jobs/4775962008	Hume AI	AI Researcher
142	https://job-boards.greenhouse.io/humeai/jobs/5064248008	Hume AI	Senior Platform Engineer
143	https://job-boards.greenhouse.io/humeai/jobs/4003488008	Hume AI	Senior/Staff AI Research Engineer
144	https://job-boards.greenhouse.io/airtable/jobs/8409168002	Airtable	AI Agent Architect, Customer Experience
145	https://job-boards.greenhouse.io/airtable/jobs/8434287002	Airtable	AI Analytics Engineer (AI & Analytics Platform)
146	https://job-boards.greenhouse.io/airtable/jobs/8470036002	Airtable	AI Analytics Engineer (Business Analytics)
147	https://job-boards.greenhouse.io/airtable/jobs/8434307002	Airtable	AI Analytics Engineer (Marketing Analytics)
148	https://job-boards.greenhouse.io/airtable/jobs/8199012002	Airtable	Product Manager, AI
149	https://job-boards.greenhouse.io/airtable/jobs/8382158002	Airtable	Program Manager, AI Programs
150	https://job-boards.greenhouse.io/airtable/jobs/8350839002	Airtable	Senior Contracts Manager, Procurement and AI
151	https://job-boards.greenhouse.io/vercel/jobs/5829980004	Vercel	Engineering Manager, AI Gateway
152	https://job-boards.greenhouse.io/vercel/jobs/5553789004	Vercel	Senior Partner Solutions Engineer
153	https://job-boards.greenhouse.io/vercel/jobs/5798406004	Vercel	Software Engineer, AI Gateway
154	https://job-boards.greenhouse.io/vercel/jobs/5474915004	Vercel	Software Engineer, AI SDK
155	https://job-boards.greenhouse.io/arizeai/jobs/5661972004	Arize AI	AI Engineer, Instrumentation
156	https://job-boards.greenhouse.io/arizeai/jobs/5818115004	Arize AI	AI Product Manager
157	https://job-boards.greenhouse.io/arizeai/jobs/5793354004	Arize AI	AI Sales Engineer, (EMEA)
158	https://job-boards.greenhouse.io/arizeai/jobs/5792327004	Arize AI	AI Sales Engineer, (US)
159	https://job-boards.greenhouse.io/arizeai/jobs/5797408004	Arize AI	AI Solutions Engineer
160	https://job-boards.greenhouse.io/arizeai/jobs/5769693004	Arize AI	AI Solutions Engineer (Charlotte)
161	https://job-boards.greenhouse.io/arizeai/jobs/5781408004	Arize AI	AI Solutions Engineer, EMEA
162	https://job-boards.greenhouse.io/arizeai/jobs/5783026004	Arize AI	AI Solutions Manager (San Francisco)
163	https://job-boards.greenhouse.io/arizeai/jobs/5396396004	Arize AI	Senior AI Product Engineer, Backend
164	https://job-boards.greenhouse.io/arizeai/jobs/5396420004	Arize AI	Senior AI Product Engineer, Fullstack
165	https://job-boards.greenhouse.io/gleanwork/jobs/4621972005	Glean	AI Outcomes Manager, ANZ
166	https://job-boards.greenhouse.io/gleanwork/jobs/4661912005	Glean	AI Outcomes Manager, Central
167	https://job-boards.greenhouse.io/gleanwork/jobs/4661913005	Glean	AI Outcomes Manager, Central
168	https://job-boards.greenhouse.io/gleanwork/jobs/4661933005	Glean	AI Outcomes Manager, East
169	https://job-boards.greenhouse.io/gleanwork/jobs/4661934005	Glean	AI Outcomes Manager, East
170	https://job-boards.greenhouse.io/gleanwork/jobs/4613925005	Glean	AI Outcomes Manager, London
171	https://job-boards.greenhouse.io/gleanwork/jobs/4586837005	Glean	AI Outcomes Manager, Singapore
172	https://job-boards.greenhouse.io/gleanwork/jobs/4673911005	Glean	AI Outcomes Manager, Sweden
173	https://job-boards.greenhouse.io/gleanwork/jobs/4661899005	Glean	AI Outcomes Manager, West
174	https://job-boards.greenhouse.io/gleanwork/jobs/4661898005	Glean	AI Outcomes Manager, West
175	https://job-boards.greenhouse.io/gleanwork/jobs/4521356005	Glean	Data Scientist, Core Product
176	https://job-boards.greenhouse.io/gleanwork/jobs/4605215005	Glean	Machine Learning Engineer, AI Assistant & Autonomous AI Agents
177	https://job-boards.greenhouse.io/gleanwork/jobs/4501783005	Glean	Machine Learning Engineer, Infrastructure
178	https://job-boards.greenhouse.io/gleanwork/jobs/4669417005	Glean	Machine Learning Engineer, LLM Evals & Observability
179	https://job-boards.greenhouse.io/gleanwork/jobs/4006735005	Glean	Machine Learning Engineer, Search Quality
180	https://job-boards.greenhouse.io/gleanwork/jobs/4675077005	Glean	Manager, AI Outcomes
181	https://job-boards.greenhouse.io/gleanwork/jobs/4585960005	Glean	Manager, AI Outcomes
182	https://job-boards.greenhouse.io/gleanwork/jobs/4612814005	Glean	Manager, AI Outcomes
183	https://job-boards.greenhouse.io/gleanwork/jobs/4667085005	Glean	Manager, AI Outcomes
184	https://job-boards.greenhouse.io/gleanwork/jobs/4549192005	Glean	Partner Solutions Engineer
185	https://job-boards.greenhouse.io/gleanwork/jobs/4577381005	Glean	Product Designer, AI Products
186	https://job-boards.greenhouse.io/gleanwork/jobs/4600865005	Glean	Product Design Lead, AI Products
187	https://job-boards.greenhouse.io/gleanwork/jobs/4525518005	Glean	Product Manager, AI Quality
188	https://job-boards.greenhouse.io/gleanwork/jobs/4591195005	Glean	Public Sector Solutions Engineer (SLED)
189	https://job-boards.greenhouse.io/gleanwork/jobs/4678146005	Glean	Senior Data Scientist, Core Product
190	https://job-boards.greenhouse.io/gleanwork/jobs/4636294005	Glean	Senior Solutions Engineer, LATAM
191	https://job-boards.greenhouse.io/gleanwork/jobs/4424103005	Glean	Senior/Staff Applied Scientist
192	https://job-boards.greenhouse.io/gleanwork/jobs/4658096005	Glean	Senior/Staff Data Scientist, Infrastructure
193	https://job-boards.greenhouse.io/gleanwork/jobs/4605446005	Glean	Software Engineer, AI & Security
194	https://job-boards.greenhouse.io/gleanwork/jobs/4012745005	Glean	Software Engineer, Machine Learning
195	https://job-boards.greenhouse.io/gleanwork/jobs/4603423005	Glean	Solutions Engineer - Commercial (Texas)
196	https://job-boards.greenhouse.io/gleanwork/jobs/4676087005	Glean	Solutions Engineering Manager
197	https://job-boards.greenhouse.io/gleanwork/jobs/4620264005	Glean	Strategic Solutions Engineer, East
